Fecha,Noticia,Sentiment_Polarity,Sentiment_Subjectivity
2024-12-06 10:11:57.315006,Decoding NVIDIA's Options Activity: What's the Big Picture?. Investors with a lot of money to spend have taken a bearish stance on NVIDIA. NVDA+0.06%. Get Free Report . And retail traders should know.,0.2,0.45
2024-12-06 10:13:57.317529,"Künstliche Intelligenz‘ stille Revolution. Warum NVDA die Führung übernimmt!. In the world of innovative technology, NVDA stands out as more than just a stock ticker for the powerhouse company, NVIDIA Corporation.",0.5,0.75
2024-12-06 09:16:57.428314,"NVIDIA: Still Looks Inexpensive Despite Racing To The Top (NASDAQ:NVDA). Nvidia's profitability continues to expand with rising margins. Read why NVDA stock is a buy, with a promising future and ongoing CapEx from tech giants.",0.2333333333333333,0.375
2024-12-06 09:16:57.448113,"NVIDIA Corporation (NVDA) Selects ZJK Industrial for Advanced Liquid Cooling Manifold Project. We recently published a list of 14 AI News and Ratings That Wall Street Is Watching. In this article, we are going to take a look at where NVIDIA...",0.2,0.425
2024-12-06 07:16:57.471184,"Nvidia Could Become Taiwan Semi's Third US Plant Customer, But With A Catch. Taiwan Semiconductor Manufacturing Co (NYSE:TSM) and Nvidia Corp (NASDAQ:NVDA) are exploring production of the front-end process of Blackwell artificial...",-0.3,0.5
2024-12-06 06:16:57.490001,"NVIDIA (NVDA) to Accelerate Launch of Next-Gen AI GPU 'Rubin'. NVIDIA (NVDA) plans to launch its 'Rubin' architecture AI GPU six months earlier than expected, targeting release in late 2025. This strategic move aims to...",-0.13333333333333333,0.5
2024-12-06 06:16:57.509627,"NVIDIA (NVDA) to Accelerate AI Dominance with Advanced Rubin Arc. NVIDIA (NVDA) is reportedly expediting the launch of its next-generation AI GPU architecture, Rubin, by six months to the latter half of 2025.",0.07777777777777779,0.25555555555555554
2024-12-06 05:16:57.533797,"Nvidia Stock: Buy, Sell, or Hold?. Over the past few years, perhaps no other stock has captured the attention of investors as much as Nvidia (NASDAQ: NVDA). Once viewed primarily as a...",0.0425,0.28500000000000003
2024-12-06 05:16:57.553720,"Sageworth Trust Co Decreases Position in NVIDIA Co. (NASDAQ:NVDA). Sageworth Trust Co cut its stake in shares of NVIDIA Co. (NASDAQ:NVDA – Free Report) by 71.9% during the 3rd quarter, according to its most recent filing...",0.225,0.3875
2024-12-06 05:16:57.576946,"NorthCrest Asset Manangement LLC Has $162.19 Million Position in NVIDIA Co. (NASDAQ:NVDA). NorthCrest Asset Manangement LLC increased its position in shares of NVIDIA Co. (NASDAQ:NVDA – Free Report) by 12.1% during the third quarter, according to...",0.2,0.4
